{
  "schemaId": "steward.impact-plan",
  "schemaVersion": 1,
  "projectId": "steward-example",
  "bindings": {
    "profileFingerprint": "sha256:80cc90512e852ab319d46c2bc09026673e688416c9df5706477223c0274f7c6e",
    "verificationCatalogFingerprint": "sha256:48268b9e7b9aa7c6e7e47d17ae1bf0ecd1cb9235826cabc7e299e8531494fd5c",
    "portableSourceFingerprint": null
  },
  "repository": {
    "provider": "git",
    "headCommit": null,
    "headTree": null,
    "baseInput": null,
    "mergeBaseCommit": null,
    "changeSnapshotFingerprint": null
  },
  "changes": {
    "committed": [],
    "staged": [],
    "unstaged": [],
    "untracked": []
  },
  "impact": {
    "mode": "full",
    "reasonCodes": [
      "CHANGE_SNAPSHOT_UNTRUSTED"
    ],
    "highImpactRules": [],
    "directPackageIds": [],
    "affectedPackageIds": [],
    "guardIds": [],
    "typecheckCaseIds": [],
    "selectedCaseIds": [
      "selector-contract",
      "core-typecheck",
      "closed-loop-typecheck",
      "linux-integration",
      "windows-integration"
    ],
    "fullCaseIds": [
      "selector-contract",
      "core-typecheck",
      "closed-loop-typecheck",
      "linux-integration",
      "windows-integration"
    ]
  },
  "contentDigest": "sha256:c13b47b180fcb10f964c617c045f35135ffc460e4d8e08044833cab74fbb7723"
}
